idx,word,meaning,link
1,고가도로 철거,1970년대에 급속도로 늘어난 고가도로는 30~40년이 지난 현대에 들어서면서 도로망과 교통체계가 변함에 따라 제기능을 발휘하지 못하고 있다.<br>교통 혼잡이 발생하거나 오래된 도로가 도시미관을 헤쳐 지역 발전을 저해한다는 시민들의 불만이 늘어나고 있다.<br>2003년부터 서울시는 적극적으로 고가도로 철거를 실시하고 있다.,https://www.seoulsolution.kr/ko/content/%EB%8F%84%EC%8B%9C%ED%99%98%EA%B2%BD-%EA%B0%9C%EC%84%A0-%EA%B3%A0%EA%B0%80%EB%8F%84%EB%A1%9C-%EC%B2%A0%EA%B1%B0-%EC%82%AC%EC%97%85
2,개축,개축이란 기존 건축물의 전부 또는 일부를 철거하고 그 대지에 종전과 같은 규모의 범위에서 건축물을 다시 축조하는 것을 말한다.,https://opengov.seoul.go.kr/civilappeal/2895278
3,옐로카펫,횡단보도 이용 시 아동이 안전하게 대기할 수 있는 아동 안전 공간이다.,http://childmaeul.org/
4,보훈회관,"보훈회관은 보훈가족, 국가유공자들이 이용하는 복지 시설이다.",https://www.hongcheon.go.kr/www/contents.do?key=477
5,특화거리,상대적으로 큰 비중을 차지하는 특정 분야를 의도적으로 집중 배치하여 상권을 활성화한 거리이다.,https://ko.dict.naver.com/#/entry/koko/45e173a0652e4cd4b5d9b3234fcd8ba0
6,돌봄교실 전면 확대,"맞벌이 가정의 자녀는 안정적인 돌봄서비스를 제공 받을 수 있으며, 지역사회와 함께하는 온종일 돌봄체계 구축 등으로 ‘학생은 행복하고 부모는 안심하는 초등돌봄교실’이 되는 것을 목표로 한다.",https://enews.sen.go.kr/news/view.do?bbsSn=152098&step1=3&step2=1
7,신촌 작은 도서관,접근성이 용이한 생활친화적 소규모 문화공간으로서 주로 독서 및 문화 프로그램을 통해 자연스럽게지역 공동체가 형성되는 도서관을 말합니다.,https://lib.jinju.go.kr/front/index.php?g_page=mini&m_page=mini01
8,국립 임시정부 기념관,대한민국 임시정부의 활동과 역사를 민주주의의 출발점으로 기억하고 후손들에게 전승하고자 대한민국 임시정부 수립 100주년을 맞이하여 건립되는 국립대한민국임시정부기념이다.,http://www.nmkpg.go.kr/c/intro
